{
  "$id": "run-timeline-row.schema.json",
  "$schema": "https://json-schema.org/draft/2020-12/schema",
  "additionalProperties": false,
  "changelog": [
    {
      "change": "Initial shape: one row an item, an offset, eight steps and the residual.",
      "version": "2026-09-15",
      "why": "Contracts before logic - the writers and the chart need one fixed shape first."
    }
  ],
  "description": "One item's bar: where it starts on the run's clock, and what it spent.",
  "properties": {
    "date": {
      "pattern": "^\\d{4}-\\d{2}-\\d{2}$",
      "title": "Date",
      "type": "string"
    },
    "extract_ms": {
      "anyOf": [
        {
          "minimum": 0,
          "type": "integer"
        },
        {
          "type": "null"
        }
      ],
      "default": null,
      "description": "Step 3. Taking the article out of the page, as the census spells it.",
      "title": "Extract Ms"
    },
    "fetch_ms": {
      "anyOf": [
        {
          "minimum": 0,
          "type": "integer"
        },
        {
          "type": "null"
        }
      ],
      "default": null,
      "description": "Step 2. Reading the page, as `ItemHealthRow.fetch_ms` spells it.",
      "title": "Fetch Ms"
    },
    "item_id": {
      "description": "The item this bar is about. An item no shard was given produces no row rather than an empty one, so an absent row reads as never worked.",
      "pattern": "^[a-z0-9]+(?:-[a-z0-9]+)*-(?:[0-9]{2,}|[0-9a-hjkmnp-tv-z]{16})$",
      "title": "Item Id",
      "type": "string"
    },
    "item_total_ms": {
      "description": "How long the bar is - what the item cost once its wait is taken out, which is the same number `ItemHealthRow.item_total_ms` holds and spelled the same way. The wait is `start_offset_ms` and is drawn as position rather than length, so counting it here would draw it twice.",
      "minimum": 0,
      "title": "Item Total Ms",
      "type": "integer"
    },
    "label_ms": {
      "anyOf": [
        {
          "minimum": 0,
          "type": "integer"
        },
        {
          "type": "null"
        }
      ],
      "default": null,
      "description": "Step 4. The label call, prefill and decode together, as the census spells it.",
      "title": "Label Ms"
    },
    "plan_ms": {
      "anyOf": [
        {
          "minimum": 0,
          "type": "integer"
        },
        {
          "type": "null"
        }
      ],
      "default": null,
      "description": "Step 1. What choosing this item cost. Null where nothing timed it.",
      "title": "Plan Ms"
    },
    "publish_ms": {
      "anyOf": [
        {
          "minimum": 0,
          "type": "integer"
        },
        {
          "type": "null"
        }
      ],
      "default": null,
      "description": "Step 8. What placing this item in the day cost. Null where nothing timed it.",
      "title": "Publish Ms"
    },
    "residual_ms": {
      "description": "`item_total_ms` minus the eight named steps: the part of the bar no step accounts for. Its own column because a step that absorbed the leftover reads as slower than it was. Signed on purpose - a negative value means two of the eight overlapped or two clocks disagreed, and the apportioned visual plan is a known overlap, so clamping it to zero would hide the one signal that says so. Derived here rather than supplied: a row that omits it gets it filled, and a row that disagrees with the arithmetic is refused.",
      "title": "Residual Ms",
      "type": "integer"
    },
    "run_id": {
      "pattern": "^\\d{4}-\\d{2}-\\d{2}-[0-9]+$",
      "title": "Run Id",
      "type": "string"
    },
    "score_ms": {
      "anyOf": [
        {
          "minimum": 0,
          "type": "integer"
        },
        {
          "type": "null"
        }
      ],
      "default": null,
      "description": "Step 7. The model-free scorers, as `EvalRow.score_ms` spells it.",
      "title": "Score Ms"
    },
    "shard": {
      "description": "Which work shard read and summarised this item. Two bars overlapping on the clock is correct exactly when they sit on different shards, and without this column a reader cannot tell an overlap from a contradiction. The plan and publish steps are not sharded; this names the shard that did the middle.",
      "minimum": 0,
      "title": "Shard",
      "type": "integer"
    },
    "start_offset_ms": {
      "description": "Milliseconds from the run's start to the moment this item's own work began. An offset and not a timestamp: the reader is asking where on the run's clock the bar sits, and an item that queued forty seconds has to sit forty seconds to the right for the queue to be visible at all.",
      "minimum": 0,
      "title": "Start Offset Ms",
      "type": "integer"
    },
    "summary_ms": {
      "anyOf": [
        {
          "minimum": 0,
          "type": "integer"
        },
        {
          "type": "null"
        }
      ],
      "default": null,
      "description": "Step 5. The summarize-and-plan call, prefill and decode together, as the census spells it.",
      "title": "Summary Ms"
    },
    "version": {
      "default": "2026-09-15",
      "pattern": "^\\d{4}-\\d{2}-\\d{2}(?:T\\d{2}:\\d{2}(?::\\d{2})?)?$",
      "title": "Version",
      "type": "string"
    },
    "visual_plan_ms": {
      "anyOf": [
        {
          "minimum": 0,
          "type": "integer"
        },
        {
          "type": "null"
        }
      ],
      "default": null,
      "description": "Step 6. What the visual plan cost. The plan is decoded inside the call above, so this is apportioned out of `summary_ms` rather than timed beside it - which is why the residual is signed.",
      "title": "Visual Plan Ms"
    }
  },
  "required": [
    "date",
    "run_id",
    "shard",
    "item_id",
    "start_offset_ms",
    "item_total_ms",
    "residual_ms"
  ],
  "title": "RunTimelineRow",
  "type": "object",
  "version": "2026-09-15"
}
